{"schema_version":"oaw.provider-descriptor/v4","descriptor_version":"4.0.0","id":"oaw/superpowers","display_name":"Superpowers","distributions":[{"id":"superpowers","source_uri":"https://github.com/obra/superpowers","revision":"44c9b2d6e889982ac18c27d05a19fefe335194e1","tree_digest":"sha256:2d18e74b7ca631e47f21985e7409e912efb7be576a59b98b109370970025487f"}],"discovery":[{"id":"sp-claude-direct","hosts":["claude"],"surface":"claude-plugin","distribution_id":"superpowers","kind":"path-exists","root":"user-home","candidate_path":".claude/plugins/superpowers","evidence_path":"skills/using-superpowers/SKILL.md"},{"id":"sp-codex-direct","hosts":["codex"],"surface":"codex-plugin","distribution_id":"superpowers","kind":"path-exists","root":"user-home","candidate_path":".codex/plugins/superpowers","evidence_path":"skills/using-superpowers/SKILL.md"},{"id":"sp-claude-marketplace","hosts":["claude"],"surface":"claude-plugin","distribution_id":"superpowers","kind":"path-exists","root":"user-home","candidate_path":".claude/plugins/marketplaces/superpowers-marketplace","evidence_path":"skills/using-superpowers/SKILL.md"},{"id":"sp-claude-official-cache","hosts":["claude"],"surface":"claude-plugin","distribution_id":"superpowers","kind":"one-level-version-path-exists","root":"user-home","evidence_path":"skills/using-superpowers/SKILL.md","prefix":".claude/plugins/cache/claude-plugins-official/superpowers"},{"id":"sp-claude-marketplace-cache","hosts":["claude"],"surface":"claude-plugin","distribution_id":"superpowers","kind":"one-level-version-path-exists","root":"user-home","evidence_path":"skills/using-superpowers/SKILL.md","prefix":".claude/plugins/cache/superpowers-marketplace/superpowers"},{"id":"sp-codex-curated-cache","hosts":["codex"],"surface":"codex-plugin","distribution_id":"superpowers","kind":"one-level-version-path-exists","root":"user-home","evidence_path":"skills/using-superpowers/SKILL.md","prefix":".codex/plugins/cache/openai-api-curated/superpowers"}],"bindings":[{"id":"codex-brainstorming","distribution_id":"superpowers","content_root":"skills/brainstorming","install_root":"skills/brainstorming","tree_digest":"sha256:e61283b5be3e879546b09cd751b1295ab6530c2fa47c511d80cb81530d7f02e3","host":"codex","surface":"codex-plugin","kind":"skill","reference":"superpowers:brainstorming","invocation":"model","responsibilities":[{"namespace":"stage","name":"problem-framing","slot_id":"problem-framing","outcome_owner":true},{"namespace":"stage","name":"solution-specification","slot_id":"solution-specification","outcome_owner":true},{"namespace":"stage","name":"delivery-plan-envelope","slot_id":"delivery-planning","outcome_owner":true}],"input_artifact":"oaw.workflow-artifact/v1","output_artifact":"oaw.workflow-artifact/v1","maximum_effects":["read-project","write-project"],"resources":["project-worktree"],"supported_topologies":["CURRENT","SUBAGENT"],"delegation":{"child":false,"parallel_child":false,"nested_child":false,"nested_parallel_child":false},"stage_span":["problem-framing","solution-specification","delivery-planning"],"internal_calls":[{"binding_id":"codex-writing-plans","required":true,"mode":"dispatch-after","stage_span":["delivery-planning"]}],"alternatives":["claude-brainstorming"],"conflicts":[]},{"id":"codex-writing-plans","distribution_id":"superpowers","content_root":"skills/writing-plans","install_root":"skills/writing-plans","tree_digest":"sha256:3277fe3f33cc932d4420f450bc5cb7b75dae9179ef2ccf5bfc38bfe3f0422f85","host":"codex","surface":"codex-plugin","kind":"skill","reference":"superpowers:writing-plans","invocation":"model","responsibilities":[{"namespace":"procedure","name":"executable-plan-detail","slot_id":"delivery-planning","outcome_owner":false}],"input_artifact":"oaw.workflow-artifact/v1","output_artifact":"oaw.workflow-artifact/v1","maximum_effects":["read-project","write-project"],"resources":["project-worktree"],"supported_topologies":["CURRENT","SUBAGENT"],"delegation":{"child":false,"parallel_child":false,"nested_child":false,"nested_parallel_child":false},"stage_span":["delivery-planning"],"internal_calls":[],"alternatives":["claude-writing-plans"],"conflicts":[]},{"id":"codex-using-git-worktrees","distribution_id":"superpowers","content_root":"skills/using-git-worktrees","install_root":"skills/using-git-worktrees","tree_digest":"sha256:3a44ea957e4b8b3326c6f61eab153b6984c85a2f05ab2076821aa622aa17183b","host":"codex","surface":"codex-plugin","kind":"skill","reference":"superpowers:using-git-worktrees","invocation":"model","responsibilities":[{"namespace":"stage","name":"workspace","slot_id":"workspace-preparation","outcome_owner":true}],"input_artifact":"oaw.workflow-artifact/v1","output_artifact":"oaw.workflow-artifact/v1","maximum_effects":["git-local","read-project","run-process","write-project"],"resources":["git-repository","project-worktree"],"supported_topologies":["CURRENT","SUBAGENT"],"delegation":{"child":false,"parallel_child":false,"nested_child":false,"nested_parallel_child":false},"stage_span":["workspace-preparation"],"internal_calls":[],"alternatives":["claude-using-git-worktrees"],"conflicts":[]},{"id":"codex-subagent-driven-development","distribution_id":"superpowers","content_root":"skills/subagent-driven-development","install_root":"skills/subagent-driven-development","tree_digest":"sha256:6ff116167e99234e8282538b87ebab63b2a9d46fef102127c677d1a1d9c8d041","host":"codex","surface":"codex-plugin","kind":"skill","reference":"superpowers:subagent-driven-development","invocation":"model","responsibilities":[{"namespace":"stage","name":"implementation","slot_id":"implementation","outcome_owner":true},{"namespace":"assurance","name":"embedded-review-remediation","slot_id":"review-remediation","outcome_owner":true}],"input_artifact":"oaw.workflow-artifact/v1","output_artifact":"oaw.workflow-artifact/v1","maximum_effects":["git-local","read-project","run-process","write-project"],"resources":["git-repository","project-worktree"],"supported_topologies":["CURRENT","SUBAGENT"],"delegation":{"child":true,"parallel_child":false,"nested_child":true,"nested_parallel_child":false},"stage_span":["workspace-preparation","implementation","implementation-tdd","incident-recovery","review-remediation","fresh-verification","closeout"],"internal_calls":[{"binding_id":"codex-using-git-worktrees","required":true,"mode":"dispatch-before","stage_span":["workspace-preparation"]},{"binding_id":"codex-finishing-a-development-branch","required":true,"mode":"dispatch-after","stage_span":["closeout"]}],"alternatives":["claude-subagent-driven-development"],"conflicts":[]},{"id":"codex-executing-plans","distribution_id":"superpowers","content_root":"skills/executing-plans","install_root":"skills/executing-plans","tree_digest":"sha256:a99904cf5509747b32ccb46c7abe2fa9cc795974c11c5c017a49f849f79dc37b","host":"codex","surface":"codex-plugin","kind":"skill","reference":"superpowers:executing-plans","invocation":"model","responsibilities":[{"namespace":"stage","name":"implementation","slot_id":"implementation","outcome_owner":true}],"input_artifact":"oaw.workflow-artifact/v1","output_artifact":"oaw.workflow-artifact/v1","maximum_effects":["git-local","read-project","run-process","write-project"],"resources":["git-repository","project-worktree"],"supported_topologies":["CURRENT","SUBAGENT"],"delegation":{"child":false,"parallel_child":false,"nested_child":false,"nested_parallel_child":false},"stage_span":["workspace-preparation","implementation","implementation-tdd","incident-recovery","review-remediation","fresh-verification","closeout"],"internal_calls":[{"binding_id":"codex-using-git-worktrees","required":true,"mode":"dispatch-before","stage_span":["workspace-preparation"]},{"binding_id":"codex-finishing-a-development-branch","required":true,"mode":"dispatch-after","stage_span":["closeout"]}],"alternatives":["claude-executing-plans"],"conflicts":[]},{"id":"codex-test-driven-development","distribution_id":"superpowers","content_root":"skills/test-driven-development","install_root":"skills/test-driven-development","tree_digest":"sha256:6dfb4b448be6669c3444457ea4189d68e36bec4255346cfcfb35fc7ec36ae222","host":"codex","surface":"codex-plugin","kind":"skill","reference":"superpowers:test-driven-development","invocation":"model","responsibilities":[{"namespace":"procedure","name":"tdd","slot_id":"implementation-tdd","outcome_owner":true}],"input_artifact":"oaw.workflow-artifact/v1","output_artifact":"oaw.workflow-artifact/v1","maximum_effects":["read-project","run-process","write-project"],"resources":["project-worktree"],"supported_topologies":["CURRENT","SUBAGENT"],"delegation":{"child":false,"parallel_child":false,"nested_child":false,"nested_parallel_child":false},"stage_span":["implementation-tdd"],"internal_calls":[],"alternatives":["claude-test-driven-development"],"conflicts":[]},{"id":"codex-systematic-debugging","distribution_id":"superpowers","content_root":"skills/systematic-debugging","install_root":"skills/systematic-debugging","tree_digest":"sha256:1454dcfd809c521f091574d8dbbeca8f6ac75d7a1101ab687f5d14c449d803e8","host":"codex","surface":"codex-plugin","kind":"skill","reference":"superpowers:systematic-debugging","invocation":"model","responsibilities":[{"namespace":"incident","name":"typed-technical-failure","slot_id":"incident-recovery","outcome_owner":false}],"input_artifact":"oaw.workflow-artifact/v1","output_artifact":"oaw.workflow-artifact/v1","maximum_effects":["read-project","run-process","write-project"],"resources":["project-worktree"],"supported_topologies":["CURRENT","SUBAGENT"],"delegation":{"child":false,"parallel_child":false,"nested_child":false,"nested_parallel_child":false},"stage_span":["incident-recovery"],"internal_calls":[],"alternatives":["claude-systematic-debugging"],"conflicts":[]},{"id":"codex-requesting-code-review","distribution_id":"superpowers","content_root":"skills/requesting-code-review","install_root":"skills/requesting-code-review","tree_digest":"sha256:afad0c1bc72d